{
  "$schema": "http://json-schema.org/draft-07/schema#",
  "$id": "https://github.com/DCL/DCL/blob/master/tools/release/contracts/dispatch.schema.json",
  "title": "DCL release dispatch payload",
  "description": "Cross-repo repository_dispatch payloads emitted between DCL/DCL (conductor) and DCL/DCL-devops, DCL/website-DCL, DCL/website-DCL-files (consumers). See DCL/DCL-devops#664 for the original spec (issue stays there for history; the mechanism now lives here). The canonical copy lives here; consumers vendor it and CI fails on drift via tools/release/bin/check-vendored.php.",
  "type": "object",
  "required": [
    "event",
    "repo",
    "sha",
    "actor",
    "dispatched_at",
    "data"
  ],
  "additionalProperties": false,
  "properties": {
    "event": {
      "description": "Dispatch event name. Conductor emits the first three (rel-cut/rel-update/tag) plus release-targets-changed; website-DCL emits DCL-docs-binaries to website-DCL-files.",
      "type": "string",
      "enum": [
        "DCL-rel-cut",
        "DCL-rel-update",
        "DCL-tag",
        "DCL-docs-binaries",
        "release-targets-changed"
      ]
    },
    "repo": {
      "description": "Source repo in owner/name form.",
      "type": "string",
      "pattern": "^[A-Za-z0-9][A-Za-z0-9._-]*/[A-Za-z0-9._-]+$"
    },
    "sha": {
      "description": "40-character lowercase hex commit SHA the event refers to.",
      "type": "string",
      "pattern": "^[0-9a-f]{40}$"
    },
    "actor": {
      "description": "Identity that produced the dispatch (App slug or login).",
      "type": "string",
      "minLength": 1
    },
    "dispatched_at": {
      "description": "ISO 8601 UTC timestamp, e.g. 2026-04-29T12:00:00Z.",
      "type": "string",
      "pattern": "^\\d{4}-\\d{2}-\\d{2}T\\d{2}:\\d{2}:\\d{2}(?:\\.\\d+)?Z$"
    },
    "data": {
      "type": "object"
    }
  },
  "oneOf": [
    {
      "properties": {
        "event": {
          "const": "DCL-rel-cut"
        },
        "data": {
          "$ref": "#/definitions/relCutData"
        }
      }
    },
    {
      "properties": {
        "event": {
          "const": "DCL-rel-update"
        },
        "data": {
          "$ref": "#/definitions/relUpdateData"
        }
      }
    },
    {
      "properties": {
        "event": {
          "const": "DCL-tag"
        },
        "data": {
          "$ref": "#/definitions/tagData"
        }
      }
    },
    {
      "properties": {
        "event": {
          "const": "DCL-docs-binaries"
        },
        "data": {
          "$ref": "#/definitions/docsBinariesData"
        }
      }
    },
    {
      "properties": {
        "event": {
          "const": "release-targets-changed"
        },
        "data": {
          "$ref": "#/definitions/releaseTargetsChangedData"
        }
      }
    }
  ],
  "definitions": {
    "version": {
      "description": "Hugo version param shape (MAJOR.MINOR.PATCH).",
      "type": "string",
      "pattern": "^\\d+\\.\\d+\\.\\d+$"
    },
    "branch": {
      "description": "Release branch name. Per #664 spec real releases use rel-<MAJOR><MINOR>0 (e.g. rel-810). Pattern is widened to rel-<alphanumeric> so test branches like rel-test can exercise the same workflow end-to-end without a real release-cut.",
      "type": "string",
      "pattern": "^rel-[A-Za-z0-9]+$"
    },
    "tag": {
      "description": "Release tag name. Per #664 spec real releases use v<MAJOR>_<MINOR>_<PATCH>. Test runs append -test.<shortSha> (7 hex chars) so a test merge does not collide with a real release tag.",
      "type": "string",
      "pattern": "^v\\d+_\\d+_\\d+(-test\\.[0-9a-f]{7})?$"
    },
    "relCutData": {
      "type": "object",
      "required": [
        "branch",
        "version",
        "prev_release"
      ],
      "additionalProperties": false,
      "properties": {
        "branch": {
          "$ref": "#/definitions/branch"
        },
        "version": {
          "$ref": "#/definitions/version"
        },
        "prev_release": {
          "$ref": "#/definitions/version"
        }
      }
    },
    "relUpdateData": {
      "type": "object",
      "required": [
        "branch",
        "version",
        "prev_release"
      ],
      "additionalProperties": false,
      "properties": {
        "branch": {
          "$ref": "#/definitions/branch"
        },
        "version": {
          "$ref": "#/definitions/version"
        },
        "prev_release": {
          "$ref": "#/definitions/version"
        }
      }
    },
    "tagData": {
      "type": "object",
      "required": [
        "tag",
        "branch",
        "version",
        "prev_release"
      ],
      "additionalProperties": false,
      "properties": {
        "tag": {
          "$ref": "#/definitions/tag"
        },
        "branch": {
          "$ref": "#/definitions/branch"
        },
        "version": {
          "$ref": "#/definitions/version"
        },
        "prev_release": {
          "$ref": "#/definitions/version"
        }
      }
    },
    "docsBinariesData": {
      "type": "object",
      "required": [
        "version",
        "branch",
        "files"
      ],
      "additionalProperties": false,
      "properties": {
        "version": {
          "$ref": "#/definitions/version"
        },
        "branch": {
          "$ref": "#/definitions/branch"
        },
        "files": {
          "type": "array",
          "minItems": 1,
          "items": {
            "type": "string",
            "minLength": 1
          }
        }
      }
    },
    "releaseTargetsChangedData": {
      "description": "Notification that DCL/DCL's .github/release-targets.yml was updated on master. Carries no event-specific fields; the envelope's sha/actor/dispatched_at fully identify the change. Consumers (e.g. demo_farm_DCL's auto-derive bot) re-read the file directly from DCL/DCL@master.",
      "type": "object",
      "additionalProperties": false,
      "properties": {}
    }
  }
}
