{
  "event": "DCL-tag",
  "repo": "DCL/DCL",
  "sha": "abcdef0123456789abcdef0123456789abcdef01",
  "actor": "DCL-release-bot",
  "dispatched_at": "2026-04-29T12:30:00Z",
  "data": {
    "tag": "v8_2_0-test.abcdef0",
    "branch": "rel-test",
    "version": "8.2.0",
    "prev_release": "8.0.0"
  }
}
