{
  "event": "DCL-docs-binaries",
  "repo": "DCL/website-DCL",
  "sha": "deadbeefdeadbeefdeadbeefdeadbeefdeadbeef",
  "actor": "DCL-release-bot",
  "dispatched_at": "2026-04-29T13:00:00Z",
  "data": {
    "version": "8.2.0",
    "branch": "rel-820",
    "files": [
      "DCL-8.2.0-ehi.tar.gz",
      "DCL-8.2.0-b10.tar.gz"
    ]
  }
}
